doc_id,sentence_id,sentence_text
121,121_8,"Gejala nyeri ini bisa muncul karena pengaruh zat - zat kimia yang dihasilkan rahim saat menstruasi yang bisa menyebabkan munculnya gejala - gejala dismenore lainnya juga seperti nyeri atau kram pada perut bawah, nyeri pinggul, nyeri punggung, mual dan muntah, diare, dan lain – lain. "
121,121_9,"Namun bila memang nyeri yang dirasakan kakak anda sangat hebat hingga mengganggu aktivitasnya, maka perlu dievaluasi kembali kemungkinan penyebab lainnya, misalnya: vulvodinia yaitu rasa nyeri ataupun rasa seperti terbakar pada vulva (area sekitar vagina) tanpa penyebab yang jelas yang terjadi selama 3 bulan atau lebih. "
121,121_10,"infeksi pada organ reproduksi, misalnya infeksi jamur (candida) ataupun infeksi bakteri (bakterial vaginosis, gonore, chlamydia) peradangan ataupun infeksi pada kulit sekitar vagina kista ataupun abses kelenjar bartholin kanker vulva dan lain - lain. "
121,121_11,Sebaiknya lakukan pemeriksaan ke dokter kembali bila memang nyeri tersebut sangat mengganggu agar bisa dievaluasi dan ditatalaksana lebih lanjut. 
121,121_12,"Sekian informasi dari saya, semoga cukup menjawab."
122,122_0,Halo Anhyy HeRman. 
122,122_1,Perdarahan akibat implantasi  (ertanam) hasil pembuahan di dalam rahim biasanya sering disalah kira sebagai menstruasi. 
122,122_2,"Perdarahan akibat implantasi biasaya hanya terjadi 1-3 hari, darah yang keluar hanya sedikit – sedikit / spotting. "
122,122_3,Perdarahan ini bisa terjadi 6-12 hari setelah proses pembuahan sel telur oleh sperma. 
122,122_4,Untuk mengetahui hamil atau tidak sebaiknya lakukan pemeriksaan  testpack. 
122,122_5,Testpack paling baik dilakukan bila Anda mengalami terlambat datang menstruasi. 
122,122_6,"Tanda kehamilan awal yang dapat dirasakan adalah mual, rasa badan tidak enak, kram - kram di perut bawah, payudara terasa tegang. "
122,122_7,"Bila memang sudah hamil namun terjadi perdarahan, hal tersebut harus diwaspadai sebagai abortus (keguguran) ataupun kehamilan ektopik. "
122,122_8,"Bila hasil testpack negatif, keluarnya darah dari kemaluan bisa terjadi pada gangguan menstruasi ataupun pada ibu hamil yang mengalami abortus komplit. "
122,122_9,"Untuk lebih pasti, sebaiknya Anda berkonsultasi dengan dokter spesialis kandungan. "
122,122_10,"Waspada bila perdarahan yang keluar bertambah banyak, disertai rasa nyeri perut bagian bawah yang hebat, serta rasa lemas. "
122,122_11,"Demikian penjelasan dari saya, semoga bermanfaat."
123,123_0,"Halo Dean, Terima kasih sudah bertanya ke Alodokter, perkenalkan saya dr Christian Haryanto akan membantu menjawab pertanyaan Anda. "
123,123_1,"Normalnya, buang air kecil dalam sehari adalah 4 sampai 8 kali sehari, dengan jumlah 1 sampai 1,8 liter per hari. "
123,123_2,"Buang air kecil lebih sering yang Anda alami kemungkinan karena terlalu banyak minum atau suatu hal yang lain, seperti: Infeksi pada saluran kemih. "
123,123_3,Kandung kemih terlalu aktif (overactive bladder). 
123,123_4,Stres atau faktor psikologis. 
123,123_5,Kehamilan. 
123,123_6,Diabetes. 
123,123_7,Batu ginjal. 
123,123_8,Gangguan prostat. 
123,123_9,Mengonsumsi obat - obatan diuretik. 
123,123_10,Stroke Divertikulitis. 
123,123_11,"Sebaiknya Anda berkonsultasi terlebih dahulu ke Dokter, untuk mengetahui penyebab dari gejala yang di alami agar dapat dilakukan pemeriksaan dan pengobatan secara tepat. "
123,123_12,Dokter akan melakukan wawancara dan pemeriksaan secara menyeluruh. 
123,123_13,"Kemungkinan akan dilakukan pemeriksaan urin dan darah pada laboratorium, USG, CT - scan atau MRI jika diperlukan. "
123,123_14,Beberapa hal yang dapat Anda lakukan adalah: Cukupi kebutuhan cairan dan gizi. 
123,123_15,Istirahat yang cukup. 
123,123_16,Menjaga kebersihan dari alat kelamin. 
123,123_17,Mengelola stres dengan baik. 
123,123_18,Semoga bermanfaat. 
123,123_19,"Salam, dr Christian Haryanto."
124,124_0,"Halo, Tri. "
124,124_1,terima kasih  atas pertanyaannya kepada tim Alodokter. 
124,124_2,Obat golongan  ACE inhibitor  adalah salah satu  pengobatan hipertensi. 
124,124_3,Obat ini bekerja dengan menghambat enzim pengubah angiotensin dan kemudian bertujuan melemaskan pembuluh darah. 
124,124_4,Kondisi inilah yang diharapkan dapat menurunkan tekanan darah. 
124,124_5,Salah satu obat golongan ini adalah ramipril. 
124,124_6,Ramipril sebaiknya digunakan berhati - hati pada kondisi berikut: - Ibu hamil dan menyusui. 
124,124_7,- Sedang dalam keadaan dehidrasi paska diare hebat atau muntah - muntah. 
124,124_8,- Pada pasien yang melakukan cuci darah atau dialisis. 
124,124_9,- Pasien yang mengonsumsi obat - obatan antinyeri  seperti ibuprofen. 
124,124_10,- Resiko alergi. 
124,124_11,"Apabila pasien menderita asma, sebaiknya lakukan konsultasi terlebih dahulu kepada dokter yang meresepkan obat sebelum mengonsumsi ramipril. "
124,124_12,"Kombinasi adalah salah satu pilihan terapi pengobatan hipertensi, yaitu dengan cara menggunakan dua obat dari dua golongan berbeda yang dikonsumsi bersama dalam satu hari, sesuai dosis dan aturan pemakaian masing - masing golongan. "
124,124_13,"Salam, dr Amy."
125,125_0,Hai Febi. 
125,125_1,KB IUD merupakan kontrasepsi intrauterin  (dalam rahim) atau yang dikenal sebagai KB spiral yang bermanfaat untuk menunda atau merencanakan kehamilan. 
125,125_2,Kontrasepsi ini memiliki angka efektivitas yang sangat tinggi (99%) dan memiliki efektivitas yang lebih tinggi dari kontrasepsi pil (92-97%) sehingga sangatlah kecil kemungkinan Anda untuk hamil bila pemasangan IUD sudah sesuai. 
125,125_3,Terdapat 2 jenis KB IUD yakni hormonal dan non hormonal. 
125,125_4,Pada pengunaan KB hormonal dapat terjadi gangguan menstruasi atau bahkan tidak menstruasi. 
125,125_5,Namun pada pengunaan KB non hormonal (IUD tembaga / copper ) umumnya dapat terjadi peningkatan jumlah dan frekuensi menstruasi. 
125,125_6,"Terkait hal ini sebaiknya Anda berkonsultasi secara langsung dengan dokter Anda atau dokter spesialis kandungan agar dilakukan pemeriksaan lebih lanjut terkait kondisi Anda karena selain akibat pengunaan kontrasepsi, gangguan menstruasi juga dapat disebabkan oleh kondisi medis lain seperti  PCOS  atau gangguan hormonal. "
125,125_7,Berikut artikel terkait pertanyaan Anda : Sisi positif dan negatif KB spiral. 
125,125_8,"Semoga bermanfaat, dr Budiono."
126,126_0,"Halo, terima kasih  atas pertanyaannya untuk Alodokter. "
126,126_1,Cyclo Progynova adalah obat yang berisi estradiol valerate. 
126,126_2,"Obat ini diberikan untuk mengatasi gejala - gejala menopause yang mengganggu, mengatasi amenorea atau tidak menstruasi pada wanita yang masih menstruasi, ataupun mengatasi siklus menstruai yang tidak teratur karena gangguan keseimbangan hormonal. "
126,126_3,"Cyclo proginova tidak sama dengan kontrasepsi hormonal, sehingga tidak akan menghambat ovulasi dan tidak akan mencegah kehamilan. "
126,126_4,Anda tidak boleh Mengonsumsi obat ini bila anda sedang hamil dan juga harus segera berhenti konsumsi obat ini bila anda hamil. 
126,126_5,Sebaiknya anda selalu mendiskusikan dengan  dokter kandungan  yang memberikan resep obat ini pada anda bila anda hendak merencanakan atau menunda kehamilan. 
126,126_6,"Sekian informasi dari saya, semoga cukup menjawab."
127,127_0,"Selamat malam, terima kasih  telah bertanya di Alodokter. "
127,127_1,Antibiotik  merupakan salah satu golongan obat yang dikenal luas oleh masyarakat. 
127,127_2,"Hal ini karena memang secara statistik, infeksi bakteri merupakan salah satu penyakit yang paling sering diderita, baik itu infeksi pada saluran pernafasan, pencernaan, kulit, telinga, saluran kemih dan lain sebagainya. "
127,127_3,Namun dalam beberapa dekade terakhir ditemukan bahwa penggunaan antibiotik seringkali tidak rasional atau tidak tepat guna. 
127,127_4,"Hal ini disamping membuang - buang biaya, juga berpotensi menimbulkan bahaya berupa bakteri yang justru akan kebal terhadap antibiotik. "
127,127_5,"Bila bakteri sudah kebal, penyembuhan penyakit akan lebih sulit dan gejalanya pun bisa jadi lebih berat. "
127,127_6,"Sehingga, sekarang antibiotik tidak boleh lagi dibeli tanpa resep dokter, dan harus dihabiskan meski gejalanya sudah mereda. "
127,127_7,"Mengenai pertanyaan Anda, tidak masalah mengonsumsi antibiotik seperti itu selama memang itu merupakan anjuran dokter. "
127,127_8,"Karena bila memang kenyataannya infeksi bakterinya berulang dan ada bukti - bukti yang mendukung, bila penanganannya hanya bisa menggunakan antibiotik, maka itu yang harus diberikan. "
127,127_9,"Yang tidak boleh adalah apabila seseorang diberikan antibiotik, namun merasa lebih baik dan menghentikan sendiri pengobatannya, lalu jika beberapa hari kemudian dia merasa gejalanya kembali, dia lanjutkan sendiri. "
127,127_10,"Tapi untuk kasus teman Anda, bila memang indikasinya jelas demikian, maka tidak masalah. "
127,127_11,"Lalu untuk pertanyaan selanjutnya, ketika antibiotik sudah terlewat 2-3 hari, sebaiknya teman Anda kembali lagi ke dokter yang sama untuk berkonsultasi. "
127,127_12,Karena selisih 2-3 hari itu cukup lama dan kadar antibiotik dalam tubuh pasti sudah hilang. 
127,127_13,"Dengan berkonsultasi ke dokter, mungkin dokter nanti akan menambahkan antibiotik karena bisa jadi pengobatannya akan diulang dari awal. "
127,127_14,"Jika tidak diulang dari awal, khawatirnya adalah jumlah obat yang sekarang tidak cukup untuk menghilangkan semua bakteri yang ada pada tubuh dan ketika obatnya habis, bakterinya masih tersisa dan malah kebal terhadap antibiotik yang sama."
128,128_0,"Selamat malam, terima kasih  telah bertanya di Alodokter. "
128,128_1,"Irritable bowel syndrome  atau bisa disebut juga IBS, merupakan kumpulan gejala yang timbul akibat adanya iritasi pada saluran cerna seperti usus. "
128,128_2,"Diantara gejalanya berupa kram perut, kembung, diare, atau malah sulit BAB atau sembelit. "
128,128_3,"Mengenai kasus Anda, bila kita melihat dari gejala penyakit IBS memang kesannya Anda mengalami IBS. "
128,128_4,"Namun untuk menentukan diagnosis, kita bukannya melihat dari sisi penyakitnya lalu gejalanya, tapi gejalanya dahulu  baru penyakitnya. "
128,128_5,"Jadi bukan berawal dari kecurigaan terhadap IBS lalu dibuktikan dengan adanya sembelit, melainkan kita melihat gejala utamanya dahulu, lalu melihat penyakit atau kondisi apa saja yang memiliki gejala tersebut. "
128,128_6,Setelah itu baru ditentukan mana diantara penyakit - penyakit tersebut yang paling ditunjang oleh bukti - bukti klinis yang ada. 
128,128_7,"Maka jika gejala utama Anda adalah sembelit, sembelit atau konstipasi bisa disebabkan oleh sejumlah faktor, seperti: Pola makan yang buruk, kurang serat dan kurang asupan cairan. "
128,128_8,Kurang aktif bergerak. 
128,128_9,Sering mengabaikan keinginan buang air besar. 
128,128_10,Efek samping obat. 
128,128_11,Adanya kelainan saraf. 
128,128_12,Adanya kelainan otot saluran cerna. 
128,128_13,"Saran kami, jika kondisi Anda sudah terjadi cukup lama dan sudah mengganggu keseharian Anda, lebih baik Anda periksakan diri Anda ke dokter umum terdekat. "
128,128_14,Dokter akan melihat apakah ada faktor - faktor diatas yang menjadi pemicu terjadinya sembelit pada diri Anda dan mencoba untuk memberikan penanganan awal. 
128,128_15,"Bila dirasa rumit atau tidak tertangani, dokter Anda mungkin akan merujuk Anda ke dokter penyakit dalam atau spesialis lain yang sesuai dengan penyebab kecurigaannya. "
128,128_16,Penanganan yang akan Anda terima nanti tergantung dari hasil pemeriksaan tersebut. 
128,128_17,"Sementara itu, Anda bisa juga mencoba penanganan mandiri dengan meningkatkan asupan air putih, buah dan sayur, perbanyak aktivitas fisik, hindari rokok, jangan tahan keinginan untuk buang air besar, upayakan untuk buang air besar di toilet jongkok, jika tidak ada toilet jongkok, upayakan untuk meletakkan kaki diatas bangku rendah agar posisi lutut lebih tinggi dari pinggang. "
128,128_18,"Bila tidak membaik atau malah memburuk, periksakan diri Anda ke dokter. "
128,128_19,"Kemudian terkait gangguan kecemasan, ini adalah diagnosis yang juga memerlukan pemeriksaan terlebih dahulu, terutama oleh psikiater. "
128,128_20,"Hal ini karena gangguan kecemasan pun bisa dirinci menjadi lebih banyak penyakit lagi, dan penanganannya pun tidak bisa didapatkan secara bebas. "
128,128_21,"Sehingga terkait kondisi ini, kemungkinan ini merupakan hal yang terpisah dengan sembelit yang Anda rasakan. "
128,128_22,"Anda bisa tanyakan pada dokter umum Anda, atau boleh langsung ke psikiater. "
128,128_23,"Selama di rumah, Anda bisa melatih pernafasan, menghirup aromaterapi, mandi dan berendam air hangat, serta menyibukkan diri dengan pikiran positif."
129,129_0,"Halo Rokhman, terima kasih  atas pertanyaannya. "
129,129_1,Gejala vagina berbau tidak selalu disebabkan oleh infeksi menular seksual terutama jika istri Anda dan Anda tidak pernah berhubungan dengan orang lain selain dengan suami / istri. 
129,129_2,"Gejala vagina berbau dapat disertai dengan keputihan yang tidak normal, yang berubah warna atau yang menyebabkan rasa gatal / perih di area kelamin. "
129,129_3,"Beberapa penyebab vagina berbau adalah: vaginosis bakterialis, yaitu infeksi bakteri yang terjadi pada vagina akibat adanya ketidakseimbangan bakteri baik di dalam vagina infeksi jamur / kandidiasis vagina. "
129,129_4,"Saran saya, silakan anjurkan istri Anda memeriksakan diri ke dokter kulit dan kelamin terdekat. "
129,129_5,Silakan Anda juga ikut memeriksakan diri bersama istri. 
129,129_6,Dokter akan memeriksa istri Anda termasuk melakukan pemeriksaan cairan keputihan bila ada untuk memastikan penyebabnya sebelum diberikan penanganan yang sesuai. 
129,129_7,"Apabila memang disebabkan oleh infeksi menular seksual seperti gonore / chlamydia / trikomoniasis, maka dokter akan memberikan penanganan yang sesuai baik untuk istri dan untuk Anda. "
129,129_8,"Untuk saat ini, jika sudah terjadi hubungan badan, maka infeksi tidak dapat dicegah. "
129,129_9,"Dengan demikian, langkah yang dapat Anda lakukan adalah memeriksakan diri bersama istri. "
129,129_10,Jika penyebabnya bukan karena infeksi menular seksual maka Anda tidak perlu khawatir tertular. 
129,129_11,"Untuk saat ini, silakan hindari berhubungan badan dengan istri dahulu  sampai istri diobati. "
129,129_12,"Silakan anjurkan istri untuk mengganti pakaian dalam teratur, hindari penggunaan sabun pembersih kewanitaan secara teratur, dan menjaga area kelamin tetap bersih dan kering. "
129,129_13,Semoga membantu.
130,130_0,Baiq yang baik. 
130,130_1,Terlambat datang bulan merupakan salah satu patokan yang sering kali digunakan oleh banyak pasangan untuk menentukan hamil tidaknya sang istri. 
130,130_2,Hal ini sebetulnya berkaitan dengan pengaruh kehamilan terhadap hormon yang mendasari mekanisme menstruasi itu sendiri. 
130,130_3,"Pada kehamilan, hormon menstruasi akan ditekan sehingga menstruasi tidak terjadi sampai kehamilan itu berakhir. "
130,130_4,"Namun demikian ada beberapa tanda lain yang biasanya ditemukan sebagai ciri kehamilan yakni : payudara bertambah sensitif, mual muntah terutama pagi hari, sering buang air kecil, mood   yang cenderung labil, merasakan kelelahan sepanjang hari, muncul bercak darah, sensitif terhadap bau. "
130,130_5,Saat ini telah banyak dijual  testpack  yang bekerja dalam mendeteksi hormon beta - HCG yang diproduksi dalam urin wanita hamil. 
130,130_6,Penggunaan  testpack  oleh awam seringkali menjadi acuan untuk menentukan hamilnya seseorang. 
130,130_7,Padahal hasil positif pada  testpack  juga dapat ditemukan pada kondisi lain seperti penyakit mola. 
130,130_8,Cara paling akurat menentukan kehamilan seseorang ialah dengan mendeteksi aktivitas jantung janin lewat pemeriksaan USG oleh dokter kandungan. 
130,130_9,Dengan demikian kami menyarankan Anda memeriksakan kondisi Anda pada dokter kandungan untuk mendapatkan penjelasan yang lebih baik. 
130,130_10,Berikut kami lampirkan artikel mengenai  tanda kehamilan. 
130,130_11,Semoga bermanfaat. 
130,130_12,dr N K Arief.
131,131_0,Halo   Nanda. 
131,131_1,"Siklus haid normal adalah 21 hingga 35 hari, dan berlangsung selama 2 hingga 7 hari. "
131,131_2,"Berbagai kondisi atau penyakit dapat menyebabkan haid terlambat, misalnya: Perubahan berat badan. "
131,131_3,Berat badan berlebih atau obesitas maupun berat badan yang sangat kurang dapat mempengaruhi siklus haid. 
131,131_4,"Sindrom ovarium polikistik (polycystic ovary syndrome,  PCOS). "
131,131_5,"Pada kondisi ini terjadi gangguan pematangan sel telur, sehingga siklus haid dapat terganggu. "
131,131_6,Penyakit pada kelenjar  tiroid. 
131,131_7,Stres. 
131,131_8,Stres dapat mempengaruhi bagian otak yang mengatur siklus haid. 
131,131_9,"Menderita penyakit kronis, misalnya diabetes. "
131,131_10,"( Baca dalam artikel:  Penyebab menstruasi tidak lancar,  Menstruasi terlambat). "
131,131_11,"Untuk mengetahui penyebab dari haid yang terlambat (atau tidak teratur), sebaiknya Anda mengkonsultasikan kembali dengan dokter spesialis kebidanan dan kandungan terdekat. "
131,131_12,"Karena diperlukan pemeriksaan lebih lanjut untuk menentukan penyebabnya, misalnya dengan pemeriksaan darah (memeriksa hormon), atau USG. "
131,131_13,"Semoga membantu, dr Vidya."
132,132_0,Dear Asyiffa. 
132,132_1,terima kasih  atas pertanyaannya. 
132,132_2,"Keluhan berupa dada terasa dingin, batuk beberapa bulan, mual, tenggorokan tidak nyaman dapat disebabkan oleh beberapa hal, dapat dikarenakan gangguan pada sistem pernafasan, atau pada sistem pencernaan Kamu, antara lain:   Radang tenggorokan. "
132,132_3,Radang Amandel. 
132,132_4,Tuberkulosis. 
132,132_5,Pneumonia. 
132,132_6,Penyakit Asam Lambung / GERD. 
132,132_7,"Tukak Lambung,   dan lain sebagainya. "
132,132_8,"Untuk menelusuri penyebab keluhan, sebaiknya Kamu diperiksa langsung oleh Dokter sehingga dapat diberi penanganan yang sesuai. "
132,132_9,Hal yang dapat dilakukan untuk mengurangi keluhan:   Berkumur dengan air garam 2 x sehari. 
132,132_10,"Kosumsi makanan sehat secara teratur, makanlah lebih sering dengan porsi kecil. "
132,132_11,Perbanyak asupan buah dan sayur. 
132,132_12,"Cukupi asupan cairan, minum 8-10 gelas per hari. "
132,132_13,"Istirahat yang cukup, tidur 8 jam sehari. "
132,132_14,olahraga teratur. 
132,132_15,Konsumsi madu yang dicampur dengan lemon. 
132,132_16,"Kelola stres psikis: meditasi, yoga. "
132,132_17,Demikian semoga lekas membaik ya. 
132,132_18,dr Annes.
133,133_0,Halo Retna!
133,133_1,Terima kasih telah menggunakan layanan konsultasi Alodokter. 
133,133_2,"Acetylcysteine merupakan obat golongan mukolitik yang berfungsi untuk mengencerkan dahak, dan oleh sebab itu umumnya diberikan pada pasien dengan batuk berdahak, seperti pada penyakit bronkitis, emfisema, asma bronkial, atau bronkiektasis. "
133,133_3,"Selain itu, walaupun jarang, obat ini dapat digunakan pada pasien - pasien dengan overdosis paracetamol, penyakit ginjal, penyakit paru obstruktif, serta beberapa penyakit psikiatri. "
133,133_4,"Jangan ragu untuk berdiskusi dengan dokter yang menangani anda mengenai obat - obat yang diberikan dan fungsinya pada kondisi atau penyakit anda, karena untuk mendapat informasi tersebut merupakan hak anda sebagai pasien, dan bisa saja obat tersebut diberikan untuk fungsinya yang lain selain pengencer dahak. "
133,133_5,"Gejala alergi dan efek samping yang dapat timbul akibat obat ini adalah gangguan saluran cerna seperti mual muntah, gatal, kulit kemerahan, bengkak, mengantuk, sesak napas, jantung berdebar - debar, gangguan fungsi hati, dan lain – lain. "
133,133_6,"Jika anda mengalami gejala - gejala tersebut, kemungkinan anda tidak cocok dengan obat tersebut, sehingga anda dapat menghentikan penggunaan obat dan kembali berkonsultasi ke dokter yang memberikan agar diberikan terapi lain yang lebih sesuai dengan kondisi anda. "
133,133_7,"Selain itu, sebelum mengonsumsi obat, untuk memastikan penggunaan obat sudah benar, jangan lupa untuk selalu memeriksa: Nama obat pada kemasan, beberapa obat memiliki nama dan bentuk yang serupa. "
133,133_8,Nama pasien pada resep obat sudah sesuai dengan nama anda. 
133,133_9,"Dosis dan aturan pakai obat, sesuaikan dengan petunjuk dokter. "
133,133_10,"Tanggal kadaluarsa obat, yang tercantum pada kemasan Indikasi, kontraindikasi, efek samping yang tercantum pada brosur obat. "
133,133_11,"Demikian, semoga dapat membantu ya. "
133,133_12,Anda juga dapat membaca artikel lain mengenai acetylcystein pada  link ini.
134,134_0,"Alo, terima kasih  atas pertanyaannya. "
134,134_1,"Mual  paling sering menandakan suatu gangguan pencernaan, semisal akibat gastroesophageal reflux disease, gastritis, penyakit Crohn, gastroenteritis, pankreatitis, alergi makanan, malabsorpsi karbohidrat, intoleransi laktosa, bahkan juga tumor jinak atau ganas tertentu di saluran pencernaan. "
134,134_2,"Namun bukan itu saja, mual bisa pula muncul karena pencetus lain, seperti: Gangguan pernafasan, contohnya akibat infeksi, alergi, kemasukan benda asing, sinusitis. "
134,134_3,"Gangguan hormon, contohnya saat hamil muda, akan menstruasi, pengaruh KB hormonal. "
134,134_4,"Faktor lain, seperti gangguan jantung, gangguan cemas berlebih, gangguan psikosomatis, gangguan hati, tumor otak, vertigo, migrain, mata lelah, cidera kepala, efek samping obat, batu atau radang empedu, gangguan ginjal, dan sebagainya. "
134,134_5,"Kondisi Anda yang merasakan mual memberat saat terpapar asap rokok dan kontak dengan air, mungkin menandakan keluhan Anda muncul karena gangguan pernafasan, alergi asap atau dingin, namun mungkin juga menandakan kondisi medis lain seperti yang telah kami jabarkan di atas. "
134,134_6,"Agar jelas apa penyebabnya, idealnya Anda periksa langsung ke dokter. "
134,134_7,"Hanya saja, mengingat saat ini pandemi COVID - 19 masih cukup mengkhawatirkan, baiknya pemeriksaan ini Anda tunda dahulu  hanya jika muncul gejala yang berat. "
134,134_8,"Sebab itu, keluhan Anda bisa coba diredakan dahulu  dengan mengompres hangat perut yang mual, mandi dengan air hangat, hindari menyikat gigi terlalu dalam saat mandi, disiplin gunakan masker terutama jika keluar rumah, jauhi rokok beserta asapnya, jauhi polusi dan hal - hal yang mungkin membuat Anda alergi, makan porsi kecil namun lebih sering, jangan dahulu  berlebihan makan makanan pencetus mual (seperti santan, sambal, kopi, teh, cokelat, dairy product), perbanyak relaksasi dan olahraga, tidur yang cukup, serta jangan sembarangan minum obat tanpa saran dari dokter. "
134,134_9,"Sebaliknya, jika muncul muntah - muntah masif, sesak, demam tinggi, atau keluhan berat lainnya, baiknya Anda periksa langsung saja ke dokter terdekat ya."
134,134_10,"Selain diberi obat, jika diduga kondisi Anda berat, nantinya dokter mungkin akan mengarahkan Anda untuk menjalani pemeriksaan darah, USG, rontgen, bahkan merujuk Anda ke  dokter penyakit dalam. "
134,134_11,Semoga membantu ya.
135,135_0,"Selamat sore, terima kasih  telah bertanya di Alodokter. "
135,135_1,"Keluhan vagina yang terasa sempit, nyeri dan gatal yang Anda rasakan, bisa berarti berbagai hal. "
135,135_2,Salah satunya bila berkaitan dengan berhubungan seksual adalah kurangnya pemanasan atau  foreplay. 
135,135_3,"Mungkin saja, karena sudah dua bulan tidak berhubungan, Anda dan suami ingin segera melakukan penetrasi, padahal vagina Anda belum siap lantaran masih belum mengeluarkan cairan pelumas yang cukup. "
135,135_4,"Hasilnya, penis jadi terasa sulit dimasukkan, dan gesekannya pun menimbulkan nyeri. "
135,135_5,Kemungkinan lain bisa juga karena pengaruh hormon. 
135,135_6,"Ketidakseimbangan hormon karena berbagai penyebab bisa membuat produksi cairan pelumas berkurang, dan mengakibatkan hal yang sama dengan yang kami sebutkan sebelumnya. "
135,135_7,"Selain itu, penyakit tertentu juga bisa mengakibatkan keluhan tersebut, seperti atrofi vagina, infeksi bakteri atau jamur, iritasi, dan masih banyak lagi. "
135,135_8,"Saran kami, jika keluhannya sudah mereda sekarang, jika lain kali berhubungan seksual lagi, kali ini perlama di bagian pemasannnya. "
135,135_9,Pastikan vagina Anda sudah cukup basah sebelum melakukan penetrasi. 
135,135_10,"Bila perlu, gunakan pelumas tambahan yang dijual bebas di apotek. "
135,135_11,"Namun jika keluhannya masih menetap, atau sekarang masih ada rasa gatal dan nyerinya meski sudah berhenti dari berhubungan seksual, maka pemeriksaan lebih lanjut amat diperlukan untuk menentukan penanganan terbaiknya. "
135,135_12,"Karena itu, konsultasikan masalah Anda pada  dokter kandungan  untuk dilakukan penggalian riwayat, pemeriksaan fisik serta penunjang, agar bisa ditentukan kecenderungannya. "
135,135_13,"Sementara itu, tidak perlu cemas, jaga kebersihan alat kelamin, hindari penggunaan celana dan celana dalam ketat, serta jalani pola hidup sehat. "
135,135_14,"Sekian, semoga menjawab pertanyaan Anda."
136,136_0,Halo   Maran. 
136,136_1,Pupil merupakan salah satu  bagian bola mata. 
136,136_2,Kondisi tidak bulat sempurnanya pupil atau bagian hitam bola mata dalam istilah medis disebut colobomas. 
136,136_3,Hal ini bersifat kongenital / bawaan sejak lahir yang mana disebabkan oleh tidak sempurnanya perkembangan mata saat dalam masa kehamilan. 
136,136_4,Namun untuk memastikan penyebab pasti dari keluhan anak Anda maka sebaiknya dilakukan pemeriksaan langsung oleh dokter. 
136,136_5,Dokter akan melakukan serangkaian pemeriksaan untuk memastikan keluhan tersebut. 
136,136_6,"Beberapa penyebab lain dari keluhan tersebut diantaranya: Horner sindrom, penyakit akibat kerusakan pada sistem saraf. "
136,136_7,Peradangan pada mata. 
136,136_8,Abses atau tumor pada bagian otak dan lain sebagainya. 
136,136_9,Apabila anak mengalami keluhan terutama pada penglihatan maka kami sangat menyarankan kepada Anda untuk membawa anak Anda ke  dokter mata  terdekat untuk mendapatkan penanganan yang tepat. 
136,136_10,Semoga bermanfaat.
137,137_0,"Halo, Terima kasih atas pertanyaanya di Alodokter. "
137,137_1,"Dalam dunia medis, yang Anda alami disebut dengan amenore (tidak haid). "
137,137_2,"Secara normal, wanita tidak mengalami haid sebelum pubertas, selama kehamilan, dan setelah menopause. "
