doc_id,sentence_id,sentence_text
374,374_5,Batu ginjal dan infeksi ginjal merupakan gangguan ginjal yang selalu dikaitkan dapat menyebabkan nyeri pinggang. 
374,374_6,"Selain dari gangguan ginjal, sakit pinggang yang berkepanjangan atau kambuh - kambuhan, dapat pula disebabkan oleh karena : siatika===  tertekannya saraf tulang belakang dan kaki, spinal spinosis===  penyempitan tulang belakang sehingga saraf tertekan, sindrom iritasi usus, infeksi saluran kemih kronis, penyakit crohn, sistitis kronis, dan lain - lain. "
374,374_7,"Karena setelah menggunakan obat, keluhan ayah Anda masih saja muncul. "
374,374_8,"Maka kami sangat menyarankan kepada Ayah Anda untuk menemui Dokter Spesialis Penyakit Dalam terlebih dahulu dan mendiskusikan masalah ini, agar dilakukan serangkaian pemeriksaan lebih lanjut. "
374,374_9,"Dokter kemungkinan akan melakukan beberapa pemeriksaan terkait keadaan ayah Anda, meliputi : pemeriksaan fisik, tes darah, USG sistem kemih, Rontgen sistem kemih, dan lain - lain. "
374,374_10,Sehingga penyebab pasti dari timbulnya sakit pinggang diketahui dan akhirnya penanganan yang tepat dapat diberikan. 
374,374_11,Klik artikel di bawah ini yang sesuai dengan pertanyaan Anda : BATU GINJAL. 
374,374_12,"Demikian penjelasan yang dapat kami sampaikan, semoga bermanfaat."
375,375_0,Hai. 
375,375_1,Sakit pinggang dapat diakibatkan oleh berbagai kemungkinan penyebab berikut ini: Cedera otot / tulang. 
375,375_2,Skiatika (peradangan dan tekanan pada saraf skiatik). 
375,375_3,Penyempitan tulang belakang. 
375,375_4,Infeksi saluran kemih / ISK. 
375,375_5,Infeksi ginjal. 
375,375_6,Batu ginjal. 
375,375_7,Penyakit radang panggul. 
375,375_8,Sindrom iritasi usus dan sebagainya. 
375,375_9,Untuk menentukan pengobatan yang tepat tentunya terlebih dahulu harus dipastikan penyebabnya. 
375,375_10,Sebaiknya ibu Anda berkonsultasi dengan dokter agar dapat dilakukan pemeriksaan lebih lanjut untuk menelusuri penyebabnya. 
375,375_11,"Pemeriksaan klinis dan tes penunjang akan dilakukan seperti tes urine, X-Ray, USG, CT Scan dan sebagainya. "
375,375_12,Dengan demikian pengobatan yang tepat akan dapat diberikan. 
375,375_13,Berikut ini anjuran yang dapat dilakukan: Beristirahat cukup dan tidur yang cukup. 
375,375_14,Batasi aktivitas fisik yang terlalu berat. 
375,375_15,Banyak minum air putih 2-3 liter sehari. 
375,375_16,Jangan menahan keinginan untuk buang air kecil. 
375,375_17,Buang air kecil secara teratur. 
375,375_18,Hindari memijat / mengurut bagian pinggang yang sakit. 
375,375_19,Jika nyeri terasa mengganggu dapat mengonsumsi ibuprofen atau paracetamol untuk meredakan nyeri. 
375,375_20,Baca laman artikel berikut ini: Penyebab nyeri pinggang. 
375,375_21,Demikian semoga bermanfaat.
376,376_0,Halo  Terima kasih telah menggunakan layanan konsultasi alodokter. 
376,376_1,Batu ginjal  dalam istilah medis sering disebut dengan batu saluran kemih. 
376,376_2,"Batu saluran kemih merupakan kondisi terbentuknya batu di sistem kemih manusia,  mulai dari ginjal,  ureter,  kandung kemih hingga di uretra / muara akhir saluran kemih. "
376,376_3,Terbentuknya batu disaluran kemih seringkali disebabkan penumpukan kristal kalsium di ginjal. 
376,376_4,"Penumpukan kristal kalsium dapat dipicu oleh kurangnya asupan cairan dalam tubuh,  terlalu berlebihan mengkonsumsi makanan atau minuman tinggi kalsium,  penggunaan vitamin c dalam jangka waktu lama,  faktor lingkungan dan gaya hidup serta faktor keturunan. "
376,376_5,"Batu saluran kemih tidak hanya dapat disebabkan oleh kristal kalsium,  namun batu dapat terbentuk dari kristal asam urat,  sistein dan batu sturvit yang sering ditemukan pada wanita. "
376,376_6,"Gejala  yang sering dikeluhkan adalah nyeri kolik / nyeri dengan intensitas kuat yang hilang timbul di perut maupun pinggang, namun terkadang juga ditemukan nyeri tumpul seperti pegal di area punggung. "
376,376_7,Nyeri disebabkan karena sumbatan batu disaluran ureter / uretra. 
376,376_8,Nyeri dapat menjalar ke bagian atas perut maupun ke area paha hingga kaki. 
376,376_9,"Beberapa kasus juga banyak ditemukan gejala seperti mual dan muntah, gangguan saat berkemih, demam,  urin berwarna merah, frekuensi berkemih yang sering namun jumlahnya sedikit sedikit. "
376,376_10,"Terkait dengan keluhan anda,  berdasarkan usia,  jenis kelamin dan gejala yang dirasakan oleh ayah anda,  kemungkinan batu saluran kemih dapat menjadi kecurigaan penyebabnya. "
376,376_11,"Namun,  diperlukan informasi lebih lengkap lagi terkait riwayat konsumsi cairan sehari  hari,  riwayat keluarga lainnya yang pernah memiliki keluhan yang sama,  apakah terdapat riwayat buang air kecil seperti berpasir,  buang air kecil berdarah,  dan lain - lain. "
376,376_12,Karena nyeri pada perut bawah atau diatas kemaluan juga dapat disebabkan oleh infeksi saluran kemih atau gangguan pada saluran pencernaan. 
376,376_13,Adanya kecurigaan batu saluran kemih sebaiknya dipastikan dengan melakukan serangkaian pemeriksaan. 
376,376_14,Jangan ragu untuk melakukan pemeriksaan ke dokter terdekat anda guna mendapatkan pemeriksaan lengkap dan tatalaksana yang tepat. 
376,376_15,"Pemeriksaan fisik secara langsung dan dibantu dengan pemeriksaan penunjang dengan urinalisis,  urin dipstick,  pemeriksaan radiologi dengan rontgen perut,  usg perut atau CT scan dapat membantu mengevaluasi secara visual gambaran batu yang terbentuk. "
376,376_16,Umumnya batu berukuran kecil dapat keluar dengan sendirinya dengan bantuan obat obatan atau mengkonsumsi air yang banyak. 
376,376_17,"Namun,  batu yang berukuran agak besar dan menyumbat cukup sulit untuk dapat keluar dengan sendirinya. "
376,376_18,Obat obatan pereda nyeri dan tindakan medis  dapat dipertimbangkan untuk mengeluarkan batu. 
376,376_19,Dewasa ini metode pengeluaran batu dapat dilakukan dalam bidang kedokteran tanpa dilakukan pembedahan terbuka. 
376,376_20,Konsultasikanlah lebih lanjut dengan dokter spesialis urologi untuk mendapatkan informasi yang lebih lengkap dan relevan. 
376,376_21,Tidak disarankan menggunakan pengobatan herbal karena efektivitasnya belum diketahui dengan pasti dalam bidang medis. 
376,376_22,Batu saluran kemih merupakan penyakit yang dapat dicegah. 
376,376_23,"Berikut ini beberapa langkah  pencegahan  dan perawatan dini bagi pasien dengan kecurigaan batu saluran kemih,  antara lain : Mengkonsumsi banyak air putih,  usahakan untuk berkemih hingga 2L per harinya. "
376,376_24,"Hindari konsumsi makanan / minuman kemasan Konsumsi makanan yang seimbang,  sehat dan bergizi. "
376,376_25,Masaklah air hingga mendidih saringlah air menggunakan filter. 
376,376_26,Hindari konsumsi makanan yang mengandung tinggi purin / asam urat. 
376,376_27,Hindari mengkonsumsi suplemen multivitamin secara berlebihan. 
376,376_28,Olahraga teratur. 
376,376_29,Istirahat cukup.
377,377_0,Halo. 
377,377_1,Batu ginjal  bisa disebabkan karena :   Makanan yang mengandung banyak kalsium oksalat penyebab batu. 
377,377_2,Kurangnya aktivitas / mobilisasi (lebih banyak duduk daripada berjalan). 
377,377_3,Dehidrasi. 
377,377_4,Makanan mengandung purin / Asam urat tinggi. 
377,377_5,Kurang minum air putih. 
377,377_6,Bentuk ginjal yang kurang normal. 
377,377_7,"Infeksi saluran kemih yang tidak diobati, dan lain - lain. "
377,377_8,Gejala batu ginjal adalah :   Nyeri pada punggung yang menjalar ke perut dan selangkangan. 
377,377_9,Nyeri saat BAK   Sulit BAK   Sering BAK. 
377,377_10,Mual - muntah. 
377,377_11,Rasa tidak nyaman pada pinggang   dan lain - lain. 
377,377_12,"Untuk pemastian penyebab nyeri yang Anda rasakan maka sebaiknya Anda memeriksakan diri secara menyeluruh ke dokter, atau jika perlu lakukanlah tes medis seperti USG dan CT SCAN atau pemeriksaan laian untuk mengetahui apa penyebab nyeri Anda. "
377,377_13,"Selain kemungkinan adanya batu ginjal, Maka beberapa kemungkinan lain penyebab keluhan Anda adalah :   Infeksi usus. "
377,377_14,Gangguan otot. 
377,377_15,Infeksi Ginjal. 
377,377_16,Gangguan tulang belakang. 
377,377_17,Sciatica   dan lain - lain. 
377,377_18,"Karena keterbatasan pengetahuan kami mengenai herbal, maka kami tidak dapat memberikan acuan yang terbaik penanganan herbal untuk batu ginjal ataupun untuk keluhan Anda. "
377,377_19,Untuk mengurangi rasa nyeri Anda bisa melakukan :   Kompres hangat bagian yang terasa nyeri. 
377,377_20,Banyak minum air putih (2 liter sehari). 
377,377_21,Minum obat pereda nyeri. 
377,377_22,Penanganan batu ginjal  yang biasa di sarankan akan tergantung dari besarnya ukuran batu tersebut. 
377,377_23,Namun pada prinsipnya penanganan bisa dengan menggunakan :   Obat peluruh batu ginjal. 
377,377_24,Operasi. 
377,377_25,ESWL = Extracorporated Shockwave Litotripsi. 
377,377_26,Perbanyak mobilisasi. 
377,377_27,"Hindari makanan yang bisa memicu pembentukan batu  = makanan mengandung asam urat, jeroan, kalsium, vitamin C dosis tinggi, seafood, tempe, tahu, dan lain - lain. "
377,377_28,Semoga membantu.
378,378_0,"Wa’alikumsalam warahmatullahi wabarokatuh, Halo Saudara Agus, terima kasih telah bertanya di Aldokter. "
378,378_1,Saya coba bantu jelaskan. 
378,378_2,"Normalnya dalam satu hari frekuensi  buang air kecil  seseorang adalah sebanyak 1-1,8 liter atau 4-8x buang air kecil. "
378,378_3,"Tetapi pada sebagian orang hal tersebut dapat terjadi secara berlebihan, bahkan terkadang menggangu ketika hendak tidur pada malam harinya. "
378,378_4,"Pada umumnya penyebab sering buang air kecil pada malam hari adalah mengkonsumsi air putih sebelum tidur, hal tersebut tentu nantinya membuat tidur terganggu karena harus terbangun untuk buang air kecil. "
378,378_5,"Tetapi ada beberapa kondisi yang menyebabkan sering buang air kecil padahal minum sedikit, yaitu : Infeksi saluran kemih, Infeksi pada ginjal, Batu ginjal, Gangguan prostat, Mengkonsumsi obat seperti furosemid, Gangguan pada saraf di kandung kemih. "
378,378_6,"Untuk mengetahui gejala yang ditimbulkan mengarah ke penyakit apa, tentunya diperlukan pemeriksaan lebih lanjut oleh dokter. "
378,378_7,"Nantinya dokter akan memeriksa kondisi fisik anda terutama pada bagian kandung kemih, dan apabila diperlukan akan dilakukan pemeriksaan tambahan seperti pemeriksaan urin, pemeriksaan prostat, USG abdomen. "
378,378_8,"Beberapa hal yang dapat dilakukan untuk membantu mengurangi gejala, seperti : Hindari mengkonsumsi air putih sebelum tidur. "
378,378_9,Melatih kandung kemih Latihan senam kegel. 
378,378_10,"Apabila keluhan dirasakan mengganggu aktivitas sehari - hari, sebaiknya diperiksakan ke dokter agar dapat ditangani lebih lanjut."
379,379_0,Hai. 
379,379_1,Nyeri pinggang dan perut bawah sebelah kanan dapat disebabkan oleh berbagai kemungkinan penyebab berikut ini:   Radang usus buntu. 
379,379_2,Gangguan usus besar. 
379,379_3,Cedera otot atau tulang. 
379,379_4,Infeksi saluran kemih / ISK. 
379,379_5,Infeksi ginjal    Batu ginjal   Gangguan organ reproduksi (pada wanita)   dan sebagainya. 
379,379_6,Untuk memastikan penyebabnya sebaiknya Anda berkonsultasi dengan dokter agar dapat dilakukan pemeriksaan lebih lanjut. 
379,379_7,"Pemeriksaan fisik dan tes penunjang akan dilakukan seperti tes urine, X-Ray, USG dan sebagainya. "
379,379_8,Dengan demikian penyebabnya akan dapat diidentifikasi dan ditangani secara tepat. 
379,379_9,Berikut ini anjuran yang dapat dilakukan:   Beristirahat dan tidur yang cukup 7-8 jam. 
379,379_10,Membatasi aktivitas yang terlalu berat. 
379,379_11,Minum banyak air putih 8-10 gelas sehari agar saluran kemih terbilas secara teratur. 
379,379_12,Jangan menahan keinginan berkemih. 
379,379_13,Buang air kecil secara teratur. 
379,379_14,Hindari memijat / mengurut bagian perut dan pinggang yang sakit. 
379,379_15,"Baca laman artikel berikut: Penyebab sakit pinggang sebelah kanan, Kenapa bisa terjadi sakit perut bagian bawah?"
379,379_16,Demikian semoga bermanfaat.
380,380_0,Halo Inar. 
380,380_1,Infeksi ginjal atau pielonefritis biasanya merupakan komplikasi dari infeksi saluran kemih yang disebabkan oleh bakteri. 
380,380_2,"Penderita infeksi ginjal umumnya merasakan gejala : sering dan nyeri saat buang air kecil, perubahan warna ataupun bau urin, nyeri atau tidak nyaman di sekitar perut samping atau bagian punggung bawah, demam atau menggigil, mual dan muntah, kehilangan selera makan, merasa kelelahan, dan lain - lain. "
380,380_3,Kemungkinan sesak yang Anda alami disebabkan oleh nyeri yang tidak tertahankan atau disebut kolik. 
380,380_4,Sebaiknya Anda segera memeriksakan diri ke dokter. 
380,380_5,Dokter akan melakukan pemeriksaan fisik dan tes urin untuk memastikan diagnosis dan tingkat keparahan infeksi ginjal yang Anda alami. 
380,380_6,"Pada kasus infeksi ginjal yang berat, diperlukan perawatan di rumah sakit. "
380,380_7,"Selain infeksi ginjal, keluhan yang Anda alami juga bisa disebabkan oleh batu ginjal ataupun kelainan pada organ reproduksi, misalnya peradangan tuba falopi, kehamilan ektopik terganggung, dan sebagainya. "
380,380_8,"Oleh karena itu, tes urin merupakan pemeriksaan awal yang secara rutin dilakukan. "
380,380_9,"Bila diperlukan dokter dapat melakukan pemeriksaan lanjutan, berupa USG ataupun pyelografi intravena. "
380,380_10,Diskusikanlah dengan dokter yang memeriksa Anda. 
380,380_11,Silahkan baca  infeksi ginjal  dan  batu ginjal. 
380,380_12,Semoga bermanfaat.
381,381_0,Halo. 
381,381_1,Keluhan rasa pegal di pinggang dan nyeri di perut bagian bawah (daerah rahim) tidak selalu berkaitan dengan gangguan di reproduksi. 
381,381_2,"Jika Anda sudah memastikan ke dokter kandungan tidak ada masalah pada saluran reproduksi, beberapa penyebab lain yang mungkin adalah:   infeksi kandung kemih,   batu kandung kemih,   cedera atau regangan otot,   infeksi ginjal,   gangguan usus. "
381,381_3,"Umumnya jika disertai gejala nyeri saat buang air kecil, Urin keruh, demam, sering buang air kecil maka akan mengarah ke infeksi saluran kemih. "
381,381_4,"Jika memiliki gejala gangguan pencernaan akan mengarah ke gangguan di usus, dan lain sebagainya. "
381,381_5,"Dalam menentukan penyebab nyeri perut tersebut memerlukan pemeriksaan langsung oleh dokter, dokter juga dapat melakukan pemeriksaan darah dan Urin di laboratorium serta USG jika perlu. "
381,381_6,"Vagina yang nyeri seperti tertarik - tarik dapat merupakan masalah yang serius jika disertai:   muncul rasa gatal, kemerahan, dan iritasi di vagina. "
381,381_7,Muncul benjolan atau bintik - bintik di vagina. 
381,381_8,Keluar lendir yang berbau serta berwarna kuning kehijauan atau coklat atau bercampur darah. 
381,381_9,Keluar flek atau perdarahan di antara siklus menstruasi. 
381,381_10,"Artikel ini dapat dibaca: Nyeri perut bawah, Penyakit pada vagina."
382,382_0,Hai. 
382,382_1,Nyeri saat berkemih (disuria) atau biasa dikenal sebagai  anyang - anyangan  dapat disebabkan oleh:   Infeksi saluran kemih. 
382,382_2,"Batu ginjal, terutama yang berada di kandung kemih. "
382,382_3,"Penyempitan saluran kemih, biasanya akibat jaringan parut (scar) pasca pemasangan selang kencing. "
382,382_4,Tumor jinak kandung kemih. 
382,382_5,Keganasan kandung kemih. 
382,382_6,Ketidakteraturan menstruasi Anda mungkin berkaitan / mungkin juga tidak berkaitan dengan gejala berkemih dan rasa gatal di liang vagina. 
382,382_7,Berikut kemungkinannya:   Berbagai  penyakit menular seksual. 
382,382_8,Endometriosis  - yaitu jaringan endometrium (lapisan dalam rahim) yang tumbuh secara \liar\ di luar tempat seharusnya. 
382,382_9,Berbagai macam  Vaginitis  (peradangan vagina). 
382,382_10,Anda sebaiknya berkonsultasi pada Dokter Anda / Spesialis Kandungan dan Kebidanan (SpOG) untuk dilakukan penggalian riwayat terarah dan pemeriksaan fisik secara langsung. 
382,382_11,"Anda juga mungkin memerlukan pemeriksaan tambahan seperti pemeriksaan spekulum (bagi yang sudah menikah), pemeriksaan air seni dan USG bila dirasa perlu. "
382,382_12,"Untuk sementara waktu, Anda sebaiknya:   Minum cukup air setiap harinya, sekurangnya 8 gelas per hari atau setiap kali Anda haus. "
382,382_13,Tidak menahan BAK. 
382,382_14,Tidak mengenakan bawahan / celana dalam ketat dan panas. 
382,382_15,Membersihkan alat kelamin setiap sehabis BAK atau hubungan intim dengan arah depan ke belakang. 
382,382_16,Artikel ini mungkin membantu: Menangani vagina gatal. 
382,382_17,"Sekian, semoga bermanfaat."
383,383_0,"Halo Hennie, Terima kasih telah bertanya ke Alodokter. "
383,383_1,"Urin yang normal bisa bervariasi warnanya, mulai dari bening hingga kuning pekat. "
383,383_2,"Selain karena jumlah cairan yang dikonsumsi, warna urin ini juga dipengaruhi oleh beragam faktor lainnya, seperti zat warna yang terkandung dalam makanan atau minuman yang dikonsumsi, pengaruh obat, hingga gangguan kesehatan tertentu, misalnya infeksi, tumor, atau batu di saluran kemih (termasuk ginjal), gangguan hati, gangguan saluran empedu, gangguan prostat, keracunan, dan sebagainya. "
383,383_3,Adapun warna urin yang Anda tetap bening usai mengkonsumsi air kunyit kemungkinan besar bukan merupakan kondisi yang berbahaya. 
383,383_4,"Jika air kunyit yang Anda konsumsi jumlahnya hanya sedikit, atau jika selain mengkonsumsi air kunyit tersebut Anda juga mengkonsumsi banyak air putih, maka sangat wajar jika warna urin Anda tetap bening, bukannya kuning. "
383,383_5,"Karenanya, tidak perlu khawatir berlebihan ya."
383,383_6,"Jika ingin memastikan, Anda bisa memeriksakan diri langsung ke dokter di fasilitas kesehatan terdekat guna dilakukan pemeriksaan lebih lanjut, misalnya tes urin, dan sebagainya. "
383,383_7,Semoga membantu ya.
384,384_0,"Halo, Terima kasih atas pertanyaannya. "
384,384_1,Apakah yang Anda maksud dengan radang ginjal adalah infeksi ginjal?
384,384_2,Kedua kondisi medis ini dapat terjadi pada waktu yang bersamaan. 
384,384_3,Infeksi ginjal  disebabkan oleh infeksi saluran kemih bagian bawah (kandung kemih) yang naik ke arah ginjal. 
384,384_4,"Infeksi ini menyebabkan penderitanya memiliki gejala sakit saat BAK, sering BAK, rasa tidak tuntas setelah BAK, warna urin yang berubah, bau urin yang berbeda, demam, sakit pada pinggang, mual, muntah. "
384,384_5,Diagnosis infeksi ginjal pada umumnya ditegakkan dengan mengetahui keluhan penderita dan pemeriksaan fisik oleh dokter. 
384,384_6,Dokter juga dapat melakukan pemeriksaan lebih lanjut seperti pemeriksaan urin dan USG ginjal. 
384,384_7,"Setelah terbukti infeksi ginjal, penderitanya akan diobati dengan antibiotik untuk beberapa waktu. "
384,384_8,"Selain itu, penderitanya juga disarankan untuk mengkonsumsi banyak air putih dan menghindari menahan BAK. "
384,384_9,Penyakit usus buntu  terjadi akibat adanya peradangan pada usus buntu yang letaknya ada di bagian kanan bawah yang terhubung dengan usus besar. 
384,384_10,Penyebab dari terjadinya penyakit usus buntu tidak diketahui dengan pasti namun kondisi ini diperkirakan berkaitan dengan tersumbatnya usus buntu oleh tinja atau adanya kelenjar getah bening yang bengkak dan menyumbat usus buntu sehingga menyebabkan peradangan. 
384,384_11,"Penderita penyakit usus buntu akan mengalami gejala sakit perut yang berawal di bagian tengah kemudian berpindah ke kanan bawah, mual, muntah, demam, konstipasi/ diare, dan tidak nafsu makan. "
384,384_12,"Untuk mendiagnosis penyakit usus buntu, dokter akan menanyakan keluhan penderita, melakukan pemeriksaan fisik, dan melakukan pemeriksaan tambahan seperti pemeriksaan darah, pemeriksaan urin, dan USG / CT scan. "
384,384_13,"Setelah terbukti penyakit usus buntu, dokter akan menyarankan operasi pengangkatan usus buntu sebagai penanganan selanjutnya. "
384,384_14,Jika Anda mengalami kedua kondisi medis ini silakan Anda berkonsultasi dengan dokter lebih lanjut. 
384,384_15,Jalani pengobatan yang dianjurkan dokter. 
384,384_16,"Jika Anda merasa nyeri pinggang atau yeri perut, Anda dapat mengkonsumsi parasetamol untuk meredakan nyeri sementara. "
384,384_17,Semoga membantu.
385,385_0,"Halo, terima kasih atas pertanyaannya. "
385,385_1,"Ngilu di area tulang belakang  hingga ke paha disertai keringat dingin paling mungkin menandakan suatu  infeksi, contohnya infeksi ginjal dan saluran kemih, infeksi pencernaan, infeksi pernapasan, demam dengue, hepatitis, meningitis, malaria, infeksi menular seksual, dan sebagainya. "
385,385_2,"Di samping infeksi, keluhan yang Anda rasakan mungkin pula muncul karena faktor lain, seperti batu ginjal, batu kandung kemih, sistitis, syaraf kejepit, rheumatoid arthritis, fibromyalgia, kekurangan nutrisi neurotropik, keganasan, dispepsia, gangguan metabolik, gangguan psikosomatis, gangguan emas berlebih, dan sebagainya. "
385,385_3,"Besar kemungkinan, keluhan Anda ini tidak terkait langsung dengan hipertensi (tekanan darah tinggi) yang Anda derita sebelumya. "
385,385_4,"Jika keluhan Anda berlangsungnya baru 2 hari belakangan, sebaiknya Anda tidak dulu panik ya."
385,385_5,"Agar mereda, upaya berikut bisa dilakukan: Kompres hangat atau oleskan krim pereda nyeri di area tulang belakang hingga paha Anda tersebut. "
385,385_6,Minum obat paracetamol bila diperlukan. 
385,385_7,"Perbanyak istirahat, tidur di alas yang nyaman sesuai dengan kelengkungan tulang belakang Anda. "
385,385_8,Selalu kenakan celana dan alas kaki yang nyaman dalam beraktifitas. 
385,385_9,"Teratur berolahraga setiap 1-2 hari sekali selama setidaknya 30 menit durasinya, contohnya dengan berenang, yoga, pilates, dan sebagainya. "
385,385_10,Batasi dulu mengangkat benda yang terlalu berat. 
385,385_11,Jangan terlalu stres. 
385,385_12,"Kontrol hipertensi dan penyakit asam lambung Anda dengan berobat teratur, batasi makanan yang megandung tinggi garam, makan porsi kecil namun sering, kurangi makan makanan pedas dan bergas. "
385,385_13,"Namun, bila ngilu terasa sangat mengganggu, atau muncul demam, kebas, lemas atau lumpuh di alat gerak, muntah - muntah, gangguan buang air besar atau kecil, dan keluhan berat lainnya, jangan sungkan periksa langsung ke dokter terdekat ya."
385,385_14,"Jika perlu, nantinya dokter bisa mengarahkan Anda untuk menjalani pemeriksaan urin, darah, rontgen, CT scan, bahkan juga merujuk Anda ke  dokter syaraf  atau  penyakit dalam. "
385,385_15,Semoga membantu ya.
386,386_0,"Halo, terima kasih atas pertanyaannya. "
386,386_1,"Perlu diperjelas, seperti apa persisnya gejala  batu ginjal  yang dialami rekan Anda tersebut?"
386,386_2,Apakah ia sudah berobat ke dokter?
386,386_3,Apakah saat ini batu ginjalnya sudah dinyatakan sembuh?
386,386_4,Material urin terkadang bisa mengeras dan membentuk batu. 
386,386_5,"Batu ini, jika terletak di ginjal, bisa melukai dinding ginjal dan menyumbat aliran urin sehingga memicu keluhan yang berat, seperti nyeri pinggang hingga punggung dan kemaluan, mual, muntah, urin berdarah, urin berwarna keruh atau berbau menyengat, anyang - anyangan, menggigil, dan sebagainya. "
386,386_6,"Tergantung keparahannya, batu ginjal ini bisa cukup ditangani dengan modifikasi gaya hidup (seperti memperbanyak minum, mengubah pola diet, menghentikan kebiasaan menahan buang air kecil), diberikan beberapa jenis obat - obatan, dioperasi, ataupun dilakukan modalitas terapi lainnya, seperti cuci darah jika batu ginjal sudah merusak ginjal dengan sangat signifikan (gagal ginjal). "
386,386_7,"Terkait pertanyaan Anda, kontak dengan nikel, apalagi dalam jangka waktu lama dan tanpa APD (alat pelindung diri) yang tepat, berisiko memperparah kerusakan ginjal. "
386,386_8,"Akan tetapi, potensi bahaya ini umumnya ditujukan utamanya pada orang yang fungsi ginjalnya sudah jelek (misalnya karena gagal ginjal). "
386,386_9,"Jika batu ginjal yang rekan Anda derita ringan saja atau bahkan sudah sembuh dengan penanganan dokter, bisa jadi tidak berbahaya baginya bekerja di area yang dekat dengan nikel. "
386,386_10,"Meski begitu, hal ini tentu saja bisa berbeda - beda, tergantung dari seberapa besar paparan nikel dan substansi berbahaya di lingkungan pekerjaan tersebut, APD yang digunakan saat bekerja, aktifitas pekerjaan yang dilakukan, status kesehatan rekan Anda secara umum, dan banyak lagi faktor lainnya. "
386,386_11,"Sebab itu, yang paling tepat menjawab akan hal ini tentulah dokter atau  dokter penyakit dalam  yang memeriksa rekan Anda. "
386,386_12,"Jadi, berkonsultasilah langsung dengan beliau ya."
387,387_0,"Selamat siang, terima kasih telah bertanya di Alodokter. "
387,387_1,"Adanya rasa sakit atau ketidaknyamanan ketika berkemih bisa disebabkan oleh berbagai hal, seperti: Infeksi saluran kemih, Batu ginjal, Batu kandung kemih, Urethritis, Dan bisa juga kemungkinan lainnya seperti adanya masalah pada prostat terutama bila usia Anda sudah mendekati paru baya. "
387,387_2,"Idealnya memang ini harus diperiksakan secara langsung, karena dokter memerlukan data tentang Anda seperti tekanan darah, hasil lab, serta pemeriksaan fisik yang tidak bisa dilakukan secara online. "
387,387_3,"Namun karena memang sekarang sedang ada wabah corona dan sebaiknya semua orang tidak keluar rumah selama itu tidak penting, maka cobalah untuk melakukan perawatan mandiri terlebih dahulu dengan memperbanyak konsumsi air putih, jangan menahan keinginan berkemih, menghindari hubungan seksual terlebih dahulu, dan mengompres area yang nyeri dengan kompres hangat. "
387,387_4,"Jika kondisinya tidak membaik dalam beberapa hari kedepan atau malah memburuk, maka tidak masalah untuk memeriksakan diri Anda ke dokter, terutama dokter umum terlebih dahulu. "
387,387_5,"Selama berada di luar rumah untuk periksa, jangan lupa kenakan masker, rutin cuci tangan, jaga jarak, dan segera mandi dan berganti baju sesampainya di rumah."
388,388_0,Hai. 
388,388_1,"Keluhan yang Anda alami kemungkinan merupakan suatu  infeksi saluran kemih / ISK, yaitu peradangan pada saluran kemih akibat infeksi bakteri. "
388,388_2,Gejala yang dapat timbul di antaranya adalah:   nyeri saat buang air kecil. 
388,388_3,buang air kecil sedikit – sedikit. 
388,388_4,sering buang air kecil. 
388,388_5,nyeri perut bagian bawah atau sekitar anus. 
388,388_6,"warna Urin menjadi keruh, kadang dapat bercampur darah. "
388,388_7,Urin berbau menyengat   dan sebagainya. 
