doc_id,sentence_id,sentence_text
244,244_10,"Apabila berat badan Anda lebih kecil dari 35 kg, maka biasanya dokter akan memberikan domperidone sirup yang dosisnya dihitung berdasarkan berat badan Anda. "
244,244_11,"Jika berat badan Anda di bawah 35 kg, silakan Anda konsultasikan kembali ke dokter Anda agar dokter dapat mengganti sediaan obat ini dan menyesuaikan dosisnya sesuai dengan berat badan Anda. "
244,244_12,Obat ini dapat diminum 3-4 kali per hari sebelum makan. 
244,244_13,Semoga informasi ini berguna. 
244,244_14,dr Aloisia.
245,245_0,"Hai Kinasih, Terima kasih telah bertanya di Alodokter. "
245,245_1,"Gejala yang Anda rasakan bisa merupakan satu kesatuan dari sebuah penyakit yang sama, namun juga bisa diakibatkan oleh beberapa kondisi dalam waktu bersamaan. "
245,245_2,"Untuk nyeri perut bagian bawah, perlu Anda perhatikan lagi apakah Anda memiliki gangguan pada berkemih, muncul benjolan atau ada gangguan pada siklus menstruasi dan sebagainya. "
245,245_3,"Lemas, kepala pusing dan terasa sangat mengantuk tidak umum dirasakan bagi orang yang baru saja makan, kecuali jika makanannya itu mengandung terlalu banyak karbohidrat dan garam. "
245,245_4,"Disamping itu juga mungkin bukan karena makanannya, namun seperti yang telah kami sampaikan, bisa saja itu karena kondisi medis lain yang muncul bertepatan setelah Anda makan. "
245,245_5,"Sehingga yang ingin kami sampaikan, sebaiknya Anda perhatikan lagi apakah gejala ini menetap atau sudah hilang sama sekali?"
245,245_6,Apakah sering atau baru pertama kali?
245,245_7,Apakah selalu nyeri perut bagian bawah disertai dengan pusing dan lemas atau apakah selalu setiap habis makan Anda merasa pusing dan lemas?
245,245_8,"Saran kami adalah agar Anda beristirahat dirumah, mengonsumsi makanan dengan nutrisi seimbang dengan sayur dan buah, menjauhi stres dan tidak terlalu memaksakan diri. "
245,245_9,"Bila setelah melakukan perbaikan pola hidup gejala masih Anda rasakan atau semakin parah, maka sebaiknya Anda periksakan diri Anda ke dokter karena untuk dapat ditegakkan, diagnosis memerlukan pemeriksaan fisik dan kadang pemeriksaan penunjang. "
245,245_10,Semoga Anda dan keluarga sehat selalu. 
245,245_11,"Sekian, semoga membantu. "
245,245_12,dr Amadeo D Basfiansa.
246,246_0,Halo!
246,246_1,Terima kasih atas pertanyaannya pada Alodokter. 
246,246_2,"Anak rewel saat makan dapat jadi disebabkan terdapat sesuatu hal yang mengakibatkan nyeri di mulut atau tenggorokannya, seperti pada kondisi berikut: Sariawan pada mulut Infeksi virus, seperti pada penyakit cacar air atau HFMD (flu singapore) yang dapat membentuk bintil - bintil nyeri di dalam mulut. "
246,246_3,Gigi akan tumbuh. 
246,246_4,Radang tenggorokan. 
246,246_5,"Benda asing yang tersangkut di rongga mulut atau tenggorokan, misalnya duri ikan. "
246,246_6,Makanan pedas atau terlalu panas dan lain sebagainya. 
246,246_7,"Untuk memastikan sebab pasti, perlu dilakukan pemeriksaan fisik langsung. "
246,246_8,Sehingga baiknya periksakan dahulu ke dokter umum. 
246,246_9,"Bila perlu dokter akan melakukan pemeriksaan penunjang seperti tes darah, atau merujuk anak ke dokter spesialis anak untuk pelacakan lanjutan. "
246,246_10,Adapun yang sebaiknya dilakukan: Berilah makanan yang lunak sehingga tidak berpotensi melukai rongga mulut atau tenggorokan. 
246,246_11,Berikan makanan yang hangat. 
246,246_12,Hindarkan anak dari makanan pedas. 
246,246_13,Jaga nutrisi anak tetap memadai. 
246,246_14,"Jaga konsumsi cairan anak tetap memadai, bergantung usia dan berat badan anak. "
246,246_15,Batasi aktivitas fisik anak. 
246,246_16,"Sekian penjelasan dari saya, semoga membantu menjawab pertanyaan Anda :)."
247,247_0,Halo!
247,247_1,Terima kasih telah menggunakan layanan konsultasi Alodokter. 
247,247_2,"Clomiphene maupun serophene merupakan obat yang sama, memiliki fungsi untuk mengatasi infertilitas / ketidaksuburan pada wanita pada kasus anovulasi (tidak dihasilkan sel telur). "
247,247_3,Obat ini bekerja dengan merangsang produksi ovum / sel telur. 
247,247_4,Obat tersebut tidak diindikasikan untuk mengatasi  haid yang tidak lancar / tidak teratur serta penggunaannya sebaiknya dibawah pengawasan oleh dokter. 
247,247_5,Siklus menstruasi berhubungan dengan regulasi hormon didalam tubuh. 
247,247_6,"Hormon estrogen dan progesteron yang dihasilkan di organ reproduksi, serta hormon FSH dan LH dari otak merupakan hormon yang berfungsi mengatur siklus menstruasi wanita dan ketika sedang menjalani masa kehamilan. "
247,247_7,Normalnya siklus menstruasi terjadi antara 28 hingga 35 hari. 
247,247_8,"Teratur atau tidaknya siklus menstruasi dipengaruhi oleh berbagai faktor, antara lain fluktuasi hormonal, makanan yang dikonsumsi, stres fisik / psikologis, kelelahan, aktivitas yang dilakukan, berat badan berlebih, efek penggunan pil kontrasepsi / obat obatan yang mengandung hormon, sindrom ovarium polikistik dan lain - lain. "
247,247_9,Masalah hormonal merupakan penyebab paling sering yang dapat mengakibatkan  siklus menstruasi menjadi tidak teratur  dan tidak lancar. 
247,247_10,Namun perlu diketahui bahwa setiap wanita memiliki pola menstruasi yang berbeda beda. 
247,247_11,"Selain keterkaitannya dengan hormon, konsumsi makanan yang kurang sehat, tidak seimbang dan pola makan yang kurang baik juga berdampak pada siklus menstruasi yang tidak teratur. "
247,247_12,"Selain itu, adanya gangguan psikologis seperti stres, depresi, cemas, juga dapat mempengaruhi regulasi hormonal. "
247,247_13,Haid yang keluar dalam bentuk flek dan jumlahnya lebih sedikit dapat dipengaruhi oleh fluktuasi hormon reproduksi yang berperan dalam siklus menstruasi. 
247,247_14,"Anda tidak perlu khawatir, hal tersebut umumnya cenderung normal dan akan membaik dengan sendirinya. "
247,247_15,"Namun, apabila siklus mendatang anda masih mengalami keluhan yang sama, cobalah lakukan konsultasi dan diskusi secara langsung dengan dokter spesialis kandungan agar mendapatkan pemeriksaan lebih lengkap. "
247,247_16,Pemeriksaan dengan USG dapat membantu anda untuk menilai kondisi rahim jika ditemukan indikasi kelainan pada organ reproduksi tersebut. 
247,247_17,"Untuk membantu memperbaiki keluhan, beberapa tips berikut dapat anda lakukan : Melakukan pola hidup sehat. "
247,247_18,Mengonsumsi makanan yang sehat dan bergizi. 
247,247_19,Menghindari stres dan kelelahan. 
247,247_20,Menghindari aktivitas berat. 
247,247_21,Hindari merokok dan konsumsi alkohol. 
247,247_22,Cukupi kebutuhan air putih. 
247,247_23,Olahraga teratur. 
247,247_24,Hindari obesitas. 
247,247_25,"Sekian informasi yang dapat saya sampaikan, semoga membantu."
248,248_0,Halo. 
248,248_1,selamat sore Ibu Rosyidah. 
248,248_2,Karat merupakan hasil dari proses oksidasi logam. 
248,248_3,"Mengingat bahwa yang berkarat adalah alat untuk mentiriskan kerupuk, bukan penggorengan ataupun spatulanya, maka sedikit kemungkinan bahwa kerupuk tersebut terpapar banyak karat, sehingga anda tidak perlu terlalu khawatir. "
248,248_4,"Meskipun demikian, anda tetap harus mewaspadai gejala keracunan logam berat akibat banyaknya karat yang tertelan, diantaranya: mengecap rasa logam di mulut, muntah - muntah, nyeri perut, dan diare. "
248,248_5,"Jika gejala - gejala tersebut muncul, segera periksakan diri dan orang - orang sekitar anda ke dokter atau unit gawat darurat terdekat untuk mendapatkan penanganan segera. "
248,248_6,"Sangat disarankan agar anda mengganti semua perabotan masak anda dengan alat masak yang baru dan anti karat, dan menjaga kebersihan alat - alat masak anda. "
248,248_7,"Sekian, semoga membantu. "
248,248_8,"Salam, dr Denisa."
249,249_0,Terima kasih Mella Melinda Andriyani atas pertanyaannya di forum Alodokter. 
249,249_1,gumoh merupakan suatu keadaan dimana seorang bayi mengeluarkan kembali makanan yang baru saja ia makan. 
249,249_2,Kondisi ini merupakan keadaan yang seringkali ditemui pada anak - anak dibawah 1 tahun. 
249,249_3,"Kondisi ini dapat memiliki frekuensi yang berbeda - beda pada tiap anak, ada yang jarang ataupun ada yang sering. "
249,249_4,"Namun terlepas dari jumlah frekuensi gumoh, kondisi gumoh yang tergolong normal biasanya memiliki ciri - ciri berupa tidak mempengaruhi tumbuh kembang anak, tidak ada melibatkan gangguan pernafasan, dan bayi terlihat tetap nyaman serta tidak rewel. "
249,249_5,"Dimana cara mengatasi gumoh ini dapat dilakukan dengan beberapa tips seperti memposisikan anak dalam posisi yang lebih tegak ketika disusui, tetap memposisikan anak dalam posisi tegak sekitar 20-30 menit setelah menyusui atau dapat juga dengan cara memberikan asupan makan dengan jumlah yang lebih sedikit namun lebih sering. "
249,249_6,"Selain itu, kondisi gumoh ini ada kalanya juga perlu diperhatikan bila pertumbuhan anak terganggu, anak tampak rewel, anak tampak sesak, frekuensi gumoh dirasakan terlalu sering atau anak tampak terpaksa (biasanya frekuensi gumoh anak pada usia 1 bulan bisa diatas 4x sehari, 50%nya gumoh dapat memiliki frekuensi 1-4x sampai usia 3 bulan), gumoh menetap hingga 1 tahun keatas, muntahan disertai darah atau warna hijau serta kuning. "
249,249_7,Pada keadaan anak Saudari saat ini sebaiknya anak tetap dapat diperiksakan lebih dahulu ke dokter terkait guna untuk memastikan kondisi yang dialami sebelum dapat diberikan suatu penanganan yang tepat. 
249,249_8,Berikut terdapat artikel seputar  gumoh. 
249,249_9,Sekian dari saya semoga dapat membantu dr Christian Chandra.
250,250_0,Dear Roflia. 
250,250_1,Dalam kehamilan tidak mungkin terjadi menstruasi. 
250,250_2,"Jadi bila Anda telah mengalami menstruasi, maka kehamilan tidak terjadi. "
250,250_3,Kehamilan dimulai dengan peristiwa bertemunya sel telur dengan sperma. 
250,250_4,Sel telur dilepaskan oleh indung telur sekitar 12-16 hari sebelum menstruasi berikutnya. 
250,250_5,"Bila dalam waktu satu hari sel telur tidak dibuahi, ia akan mati. "
250,250_6,Sedangkan sel sperma mampu bertahan hidup hingga 3 hari dalam organ reproduksi wanita. 
250,250_7,"Bila tidak terjadi pembuahan, menstruasi akan terjadi lagi sesuai siklusnya. "
250,250_8,"Bila terjadi pembuahan, dalam waktu 7-10 hari hasil pembuahan akan tertanam dalam dinding rahim. "
250,250_9,"Dalam dinding rahim, plasenta akan dibentuk dan hormon hCG akan dihasilkan. "
250,250_10,Hormon inilah yang memberikan hasil positif pada pemeriksaan testpack. 
250,250_11,Pemeriksaan testpack dapat dilakukan satu hari setelah mengalami keterlambatan menstruasi. 
250,250_12,Bila hasilnya negatif dapat diulangi seminggu lagi. 
250,250_13,"Bila hasilnya tetap negatif, kemungkinan Anda tidak hamil. "
250,250_14,Namun kehamilan baru bisa dipastikan mulai minggu kelima hingga ketujuh setelah pembuahan melalui pemeriksaan USG dengan melihat kantong kehamilan yang berisi janin. 
250,250_15,"Berikut artikel yang dapat Anda baca: Proses pembuahan, Tes awal kehamilan dengan testpack, Tanda - tanda kehamilan."
251,251_0,"Halo, Tania, terima kasih sudah bertanya pada Alodokter. "
251,251_1,"Secara umum, hasil lab yang Anda kirimkan pada saya masih normal, kecuali untuk kadar Hemoglobin (Hb), eritrosit (sel darah merah) memang agak rendah, namun masih dalam batas normal untuk ibu hamil trimester 2 seperti Ibu. "
251,251_2,"Menurut parameter tentang kadar Hb normal pada ibu hamil, pada trimester pertama : lebih dari 11 gr / dL, trimester kedua: lebih dari 10,5 gr / dL, dan trimester ketiga: lebih dari 11 gr / dL. "
251,251_3,"Namun, ada sumber lain (World Health Organization) mengatakan bahwa pada ibu hamil yang memiliki Hb di bawah 11 gr / dL sudah dikatakan anemia, namun yang menurut WHO ini ibu termasuk dalam kategori anemia ringan. "
251,251_4,Anemia adalah kekurangan sel darah merah dan Hb sehingga dapat mengganggu penyampaian oksigen ke organ dan jaringan. 
251,251_5,"Efek ringannya ibu mengalami kelelahan, lesu, namun efek beratnya bisa menyebabkan ibu sesak, berdebar - debar, dan bisa berefek pada janin (bayi lahir dengan berat kurang, persalinan premature). "
251,251_6,Ibu hamil memang rentan menderita anemia. 
251,251_7,"Ada beberapa penyebab  anemia pada ibu hamil  yang sering terjadi:   -       Kekurangan zat besi - Kekurangan asam folat, - Kekurangan vitamin B12 Untuk memastikan penyebab anemia, harus dilakukan pemeriksaan lebih lanjut ke dokter. "
251,251_8,"Sebaiknya, Ibu rajin kontrol ke dokter / bidan untuk ANC (Ante Natal Care), agar dilakukan pemeriksaan lengkap terhadap kesehatan ibu juga kesehatan dan pertumbuhan janin yang dikandung sehingga mendapatkan penanganan yang tepat sesuai kondisi ibu. "
251,251_9,"Jika ibu memiliki tanda - tanda anemia seperti: lemah, letih, lesu, sesak, pusing, berdebar - debar, sakit kepala, rambut rontok, sariawan, telinga berdenging, segeralah pergi ke dokter untuk dilakukan pemeriksaan yang lengkap. "
251,251_10,"Jangan khawatir, yang dapat Ibu lakukan sekarang adalah memastikan kecukupan nutrisi dan cairan yang ibu konsumsi (terutama sumber zat besi: sayur hijau, telur, daging merah, ikan, ayam, kacang - kacangan, dan makanan yang meningkatkan penyerapan zat besi, misalnya yang buah - buahan yang mengandung vitamin C), dan bisa dibantu dengan mengonsumsi tablet besi. "
251,251_11,"Semoga informasi yang saya berikan bisa bermanfaat ya, Tania."
252,252_0,"Halo Ens, terima kasih sudah bertanya di Alodokter. "
252,252_1,"TBC adalah penyakit infeksi paru yang  disebabkan karena bakteri M. Tuberculosis, dimana penularan dapat terjadi secara airborn dan droplet (baik karena percikan dahak, atau batuk). "
252,252_2,"Terapi dari TB sendiri berbeda dengan infeksi paru pada umumnya, dimana pada terapi TB menggunakan regimen pengobatan berbeda, dan dilakukan dalam waktu yang cukup lama, setelah pengobatan selesai diperlukan pemeriksaan ulang untuk mengetahui status dari TB, apakah sudah sembuh, atau perlu terapi lanjutan. "
252,252_3,"Bila Anda sudah menjalani pengobatan selama 6 bulan, dan dikatakan sembuh, maka kemungkinan besar memang Anda sudah betul betul sembuh (meskipun umumnya pengobatan hingga 9 bulan - 12 bulan). "
252,252_4,"Sesak nafas dapat disebabkan oleh banyak hal, seperti pada kondisi asma, iritasi dari asap rokok, gangguan fungsi jantung, penyakit paru obstruktif kronis, TB, dan masih banyak lagi. "
252,252_5,"Merokok dapat menyebabkan asap masuk hingga kedalam saluran nafas, sehingga menimbulkan 'injury' dari sel sel epitel pelapis dari saluran nafas, dimana akan terjadi peradangan, dan menghilangnya fungsi proteksi pada saluran nafas -- batuk terus menerus, dahak menjadi kental, dan sebagainya. "
252,252_6,"Bila kondisi proteksi dari saluran nafas menghilang, maka risiko untuk terjadinya infeksi saluran nafas semakin besar. "
252,252_7,Selain itu reaksi radang yang terus berulang (akibat asap rokok) dapat menimbulkan / mencetus terjadinya proses keganasan / kanker pada saluran nafas (hingga paru) bila memang memiliki faktor risiko yang memadai. 
252,252_8,Oleh karena mengapa kami menyarankan untuk berhenti merokok. 
252,252_9,"Seseorang dapat mengalami kekambuhan dair TB paru, berikut beberapa faktor yang memicu timbulnya kekambuhan : Daya tahan tubuh yang menurun secara signifikan (seperti pada orang dengan HIV / AIDS, mengonsumsi obat imunodepresan jangka panjang, dan lain sebagainya), infeksi berulang dari orang lain (bila Anda memiliki rekan / orang yang tinggal bersama Anda dengan TB (+), maka kemungkinan tertular semakin besar), pengobatan TB yang tidak tuntas, dan lain lain. "
252,252_10,"Oleh karena itu bila Anda merasa ragu, kami sarankan Anda untuk menemui dokter untuk dilakukan wawancara medis lebih lanjut, pemeriksaan fisik serta pemeriksaan lanjutan (pemeriksaan dahak, pemeriksaan foto  rontgen dada, pemeriksaan darah, dan lain sebagainya) untuk memastikan kondisi anda saat ini. "
252,252_11,"Untuk saat ini beerikut beberapa hal yang dapat anda lakukan : Berhenti merokok â€“ bila merokok, Jaga kebersihan udara di sekitar rumah anda. "
252,252_12,"Pastikan ventilasi udara dirumah anda baik, dan cahaya matahari dapat masuk ke dalam rumah. "
252,252_13,Buka jendela dan pintu rumah saat pagi hari agar sirkulasi udara baik. 
252,252_14,"Bila anda sedang batuk / anggota keluarga lain yang tinggal dirumah sedang batuk, berikan masker agar tidak menularkan pada orang lain. "
252,252_15,Hindari membuang dahak sembarangan. 
252,252_16,Minum air putih lebih banyak. 
252,252_17,Konsumsi makanan bergizi dan bernutrisi baik Istirahat yang cukup. 
252,252_18,Olahraga teratur 3x seminggu. 
252,252_19,"Sekian informasi yang dapat kami sampaikan, semoga bermanfaat."
253,253_0,Halo. 
253,253_1,Terlambat menstruasi tidak selalu disebabkan oleh kondisi yang serius sehingga Anda tidak perlu terlalu kuatir. 
253,253_2,Berikut beberapa kemungkinan penyebab terjadinya keterlambatan menstruasi:   Stres psikis. 
253,253_3,Ketidakseimbangan hormonal. 
253,253_4,Kehamilan. 
253,253_5,Aktivitas fisik yang berat dan melelahkan tubuh. 
253,253_6,Pola gizi yang kurang nutrisi. 
253,253_7,Penurunan berat badan yang drastis. 
253,253_8,Gangguan tiroid. 
253,253_9,Sindrom polikistik ovarii (PCOS)   dan sebagainya. 
253,253_10,Terlambat menstruasi yang Anda alami dapat berhubungan langsung maupun tidak dengan riwayat nyeri perut kiri yang Anda alami sebelumnya. 
253,253_11,Berikut ini anjuran yang dapat Anda lakukan:   Beristirahat dan tidur yang cukup 7-8 jam sehari. 
253,253_12,"Jangan terlalu lelah, batasi aktivitas fisik yang berat. "
253,253_13,Mengonsumsi makanan yang bergizi seimbang. 
253,253_14,Menjaga berat badan ideal. 
253,253_15,Hindari diet ketat. 
253,253_16,Berolahraga secara teratur. 
253,253_17,Mengelola stres dengan bijak. 
253,253_18,Jika keluhan terus berlanjut Anda dapat berkonsultasi dengan dokter agar dapat dipastikan penyebabnya. 
253,253_19,"Melalui pemeriksaan fisik dan tes penunjang tertentu (tes darah, tes urine, USG dan sebagainya) dokter akan menelusuri penyebabnya dan memberikan penanganan yang tepat. "
253,253_20,Baca laman artikel berikut ini: Penyebab menstruasi terlambat. 
253,253_21,Telat haid tidak selalu dikaitkan dengan kehamilan. 
253,253_22,Demikian semoga bermanfaat.
254,254_0,"Alo, terima kasih sudah bertanya di Alodokter. "
254,254_1,Postinor merupakan kontrasepsi darurat yang mengandung levonorgestrel. 
254,254_2,Kontrasepsi ini digunakan oleh wanita sesaat setelah berhubungan seksual tanpa pengaman. 
254,254_3,Obat ini bekerja dengan menghambat indung telur untuk melepaskan sel telur sehingga tidak akan terjadi pembuahan. 
254,254_4,Dengan tidak adanya pembuahan maka kehamilan tidak akan terjadi. 
254,254_5,Secara umum biasanya postinor dapat berisi 1 tablet maupun 2 tablet. 
254,254_6,Postinor yang berisi 2 tablet dapat dikonsumsi secara langsung 2 tablet dalam 120 jam pertama atau satu per satu berjarak 12 jam. 
254,254_7,"Untuk memastikan mana yang direkomendasikan, sebaiknya bacalah aturan pemakaian pada kemasan obat. "
254,254_8,Atau anda juga bisa mengkonsultasikan hal ini pada dokter spesialis kandungan untuk informasi lebih lanjut.
255,255_0,Alo. 
255,255_1,"Gejala BAK tidak tuntas, nyeri serta skrotum kanan yang membengkak sebaiknya dikonsultasikan kepada dokter. "
255,255_2,"Berbagai kemungkinan penyebabnya adalah: infeksi saluran kemih, batu saluran kemih, peradangan pada prostat atau pembesaran prostat. "
255,255_3,"Jika maksud Anda pemasangan URS (ureterorenoscopy), prosedur diagnostik untuk mengetahui keadaan saluran kemih, seharusnya sudah diketahui bagaimana keadaan saluran kemih Anda oleh dokter, misalnya ada tidaknya batu, sumbatan, dan lain - lain. "
255,255_4,"Prosedur ini juga dapat menimbulkan efek samping (tidak selalu), seperti infeksi saluran kemih maupun peradarahan pada saluran kemih. "
255,255_5,Sebaiknya Anda kembali berkonsultasi dengan dokter urologi Anda. 
255,255_6,"Keluhan yang Anda rasakan (BAK tidak tuntas, nyeri, bengkak di testis) perlu dicari tahu penyebabnya dan diobati dengan baik, misalnya jika penyebabnya infeksi saluran kemih akan diberikan antibiotik yang sesuai dengan kuman penyebabnya. "
255,255_7,Dalam hal ini minum obat pereda nyeri saja belum cukup. 
255,255_8,"Beberapa anjuran: konsumsi air putih yang cukup, tidak menahan BAK."
256,256_0,Halo Rahma. 
256,256_1,Terima kasih telah bertanya ke Alodokter. 
256,256_2,"Perlu diperjelas, apakah menstruasi Anda selalu berjalan teratur sebelumnya?"
256,256_3,"Usai menstruasi terakhir Anda, apakah Anda pernah melakukan hubungan seksual tanpa pengaman?"
256,256_4,Belum datangnya menstruasi  sebagaimana yang Anda alami bisa merupakan kondisi yang wajar jika Anda sebelumnya mengalami menstruasi yang tidak beraturan. 
256,256_5,"Asalkan jarak antar siklus menstruasi Anda tidak sampai melebihi 35 hari, seringnya kondisi ini tidaklah berbahaya. "
256,256_6,Adapun kondisi payudara Anda yang terasa nyeri dan juga mual bisa saja merupakan bagian dari gejala bahwa menstruasi Anda sebentar lagi akan datang. 
256,256_7,"Akan tetapi, jika usai menstruasi terakhir Anda pernah melakukan hubungan seksual tanpa pengaman, maka mungkin juga keterlambatan menstruasi Anda terjadi karena  kehamilan. "
256,256_8,"Bisa juga, selain karena hamil, menstruasi datang terlambat karena hormon yang tidak seimbang, stres, kelelahan, efek samping obat, efek samping kontrasepsi, kista ovarium, gangguan kelenjar tiroid, atau penyakit kronis lainnya. "
256,256_9,Anda sebaiknya coba dulu lakukan testpack. 
256,256_10,"Dengan pemeriksaan ini, tentu bisa dibedakan keterlambatan menstruasi yang disebabkan oleh kehamilan dan oleh sebab lain. "
256,256_11,"Bisa juga, Anda periksakan langsung diri Anda ke dokter atau  dokter spesialis kandungan  agar dilakukan pemeriksaan lanjutan, misalnya tes darah atau USG guna mendapat hasil pemeriksaan yang lebih akurat. "
256,256_12,"Sebelum dipastikan bahwa keterlambatan menstruasi Anda tidak terjadi berkaitan dengan kehamilan, sebaiknya buang jauh - jauh niatan Anda untuk mengkonsumsi obat atau suplemen pelancar menstruasi apapun. "
256,256_13,"Agar menstruasi berjalan lebih teratur, Anda cukup merubah pola hidup Anda menjadi lebih sehat, contohnya dengan tidur dan bangun lebih teratur setiap harinya, lebih rajin makan buah dan sayur-sayuran, biasakan berpikir positif dan jangan stres, sekaligus memperbanyak olahraga agar berat badan selalu ideal. "
256,256_14,"Lebih lanjut, bila ternyata Anda tidak sedang hamil, namun berniat untuk menunda atau mencegah kehamilan, Anda sebaiknya berkonsultasi juga dengan dokter supaya dipilihkan jenis kontrasepsi yang paling cocok dengan kondisi Anda."
257,257_0,Halo Jessy. 
257,257_1,Terima kasih atas pertanyaanya di Alodokter. 
257,257_2,Salah satu efek samping obat rifampicin adalah urin yang berwarna merah hal ini normal pada orang yang meminum obat rifampicin dan tidak berbahaya sehingga tidak diperlukan penanganan yang khusus. 
257,257_3,Hal tersebut disebabkan karena metabolisme obat rifampicin yang dikeluarkan melalui urin sehingga selama Anda masih mengkonsumsi obat rifampicin kemungkinan masih dapat mengalami hal tersebut. 
257,257_4,"Sedangkan efek samping yang lain pada rifampicin yaitu sakit kepala, mengantuk, lemas, diare, mual, nafsu makan berkurang, serta keringat dan lensa kontak dapat berwarna kemerahan (bila Anda menggunakan lensa kontak disarankan untuk menggunakan kacamata selama meminum obat ini). "
257,257_5,"Untuk tata cara meminum obat pirazinamide pada prinsipnya diminum pada jam yang sama setiap harinya, sehingga jarak minum pirazinamid yang satu dan yang lainnya sama, bila Anda minum sehari 2 kali diharapkan jarak minum pirazinamid yang satu dengan yang setelahnya dengan jarak selama 12 jam misal pada jam 9 pagi dan dosis setelahnya diminum pada jam 9 malam. "
257,257_6,"Sedangkan apabila Anda lupa meminum pirazinamide disarankan segera meminumnya begitu teringat jika jadwal dosis selanjutnya tidak berdekatan, dan jangan menggandakan dosis pada jadwal berikutnya bila dosis sebelumnya terlewat. "
257,257_7,Kalnex merupakan obat yang berisi obat asam traneksamat yang berfungsi untuk mencegah dan mengurangi perdarahan. 
257,257_8,Obat ini termasuk golongan obat antifibrinolitik yang melambatkan pemecahan bekuan darah sehingga perdarahan tidak berlangsung lama. 
257,257_9,Pada dasarnya obat ini tidak mengandung hormon sehingga tidak memberikan efek samping terhadap siklus menstruasi. 
257,257_10,"Efek samping yang sering timbul pada obat ini antara lain mual, muntah, diare, dan nyeri otot. "
257,257_11,Namun apabila ditemukan efek samping yang lain silahkan kosnultasikan diri Anda ke dokter. 
257,257_12,"Demikian informasi dari saya, semoga bermanfaat. "
257,257_13,Informasi lain terkait dengan pertanyaan Anda dapat dibaca pada tautan berikut: Rifampicin Pirazinamid Kalnex.
258,258_0,Halo Dian. 
258,258_1,Berapa usia adik Anda?
258,258_2,"Apakah bayi baru lahir, hitungan bulan, atau sudah di atas 1 tahun Bagaimana maksud 13x BAB?"
258,258_3,apakah 13x dalam sehari atau bagaimana?
258,258_4,"Untuk bayi baru lahir normalnya warna feses / tinjanya hijau kehitaman, kemudian setelah usia 2-4 hari menjadi hijau kecoklatan, setelah usia 3-5 hari warnanya menjadi kuning terang bila ASI atau coklat muda bila mengkonsumsi susu formula. "
258,258_5,Semakin lama warna feses bayi akan semakin coklat seperti feses dewasa terutama bila sudah MPASI. 
258,258_6,"Untuk tekstur feses bisa bervariasi dari agak gembur, menggumpal, hingga kasar. "
258,258_7,Semakin besar usia anak teksturnya akan semakin mirip dengan feses dewasa. 
258,258_8,Sayangnya Anda tidak menyebutkan dengan jelas mengenai usia adik Anda dan frekuensi BABnya sehingga saya tidak bisa memastikan apakah warna feses adik Anda masih dalam batas normal atau tidak. 
258,258_9,"Secara umum  warna feses  yang perlu diwaspadai adalah apabila feses berlendir, berdarah, berwarna hijau, merah, putih / sangat pucat, dan hitam. "
258,258_10,Bila ada perubahan warna feses seperti ini sebaiknya diperiksakan langsung ke dokter. 
258,258_11,"Terkait dengan frekuensi BAB, hal ini juga bergantung pada usia adik Anda. "
